A1: Period 2 | B1: age (yrs) | C1: height (cm) | D1: Per 3 | E1: age(yr) | F1: height(cm)
B2: 13.75 | C2: 173.99 | E2: 16.25 | F2: 175.35
B3: 13.75 | C3: 170.18 | E3: 14.30 | F3: 160.02
B4: 13.83 | C4: 175.26 | E4: 16.50 | F4: 175.26
B5: 13.92 | C5: 165.10 | E5: 16.50 | F5: 175.26
B6: 14.08 | C6: 160.02 | E6: 14.75 | F6: 170.18
B7: 14.33 | C7: 167.64 | E7: 14.30 | F7: 167.64
B8: 14.40 | C8: 177.80 | E8: 14.83 | F8: 175.26
B9: 14.42 | C9: 173.99 | E9: 15.75 | F9: 160.02
B10: 14.91 | C10: 167.64 | E10: 14.50 | F10: 175.26
B11: 15.00 | C11: 172.72 | E11: 15.90 | F11: 175.26
B12: 15.04 | C12: 160.02 | E12: 15.40 | F12: 180.88
B13: 15.09 | C13: 154.94 | E13: 14.17 | F13: 175.26
B14: 15.10 | C14: 167.64 | E14: 14.85 | F14: 160.02
B15: 15.16 | C15: 177.80 | E15: 15.17 | F15: 177.80
B16: 15.20 | C16: 172.72 | E16: 15.16 | F16: 170.00
B17: 15.25 | C17: 172.72 | E17: 13.75 | F17: 162.56
B18: 15.25 | C18: 175.80 | E18: 16.25 | F18: 172.72
B19: 15.25 | C19: 177.80 | E19: 15.66 | F19: 177.80
B20: 15.25 | C20: 167.64 | E20: 15.30 | F20: 157.48
B21: 15.33 | C21: 164.70 | E21: 17.40 | F21: 172.72
B22: 15.33 | C22: 152.40 | E22: 15.83 | F22: 175.26
B23: 15.48 | C23: 154.94 | E23: 15.25 | F23: 167.64
B24: 15.50 | C24: 172.72 | E24: 16.30 | F24: 174.96
B25: 15.75 | C25: 172.42 | E25: 16.83 | F25: 167.64
B26: 15.75 | C26: 181.44 | E26: 15.83 | F26: 177.80
B27: 15.75 | C27: 177.80 | E27: 15.66 | F27: 175.26
B28: 15.83 | C28: 170.18 | E28: 15.59 | F28: 180.34
B29: 15.83 | C29: 172.72 | E29: 15.92 | F29: 185.42
B30: 16.40 | C30: 172.72 | E30: 14.25 | F30: 162.56
B31: 16.75 | C31: 165.24 | E31: 15.60 | F31: 185.42
B32: 16.83 | C32: 167.64 | E32: 16.75 | F32: 175.26
B33: 16.91 | C33: 187.96 | E33: 16.25 | F33: 185.45
B34: 17.08 | C34: 175.26 | E34: 14.12 | F34: 167.64
B35: 17.66 | C35: 167.64 | D35: average | E35: =AVERAGE(F2:F34) -> 15.480909090909091 | F35: =AVERAGE(G2:G34) -> 172.64848484848486
B36: 17.75 | C36: 180.34
A37: average | B37: =AVERAGE(B2:B36) -> 15.397428571428568 | C37: =AVERAGE(C2:C36) -> 170.5011428571429

A1: Per 4 | B1: age (yr) | C1: height (cm)
B2: 16.75 | C2: 160.02
B3: 16.67 | C3: 180.34
B4: 15.17 | C4: 167.64
B5: 15.42 | C5: 162.56
B6: 14.33 | C6: 160.02
B7: 15.25 | C7: 160.02
B8: 17.75 | C8: 165.10
B9: 15.08 | C9: 172.72
B10: 16.33 | C10: 172.72
B11: 15.00 | C11: 170.18
B12: 14.33 | C12: 160.02
B13: 15.75 | C13: 170.18
B14: 14.33 | C14: 170.18
B15: 14.67 | C15: 167.64
B16: 15.25 | C16: 167.64
B17: 16.27 | C17: 170.18
B18: 14.16 | C18: 167.64
B19: 14.25 | C19: 167.64
B20: 15.08 | C20: 152.40
B21: 15.33 | C21: 167.64
B22: 17.25 | C22: 162.56
B23: 14.02 | C23: 165.10
B24: 15.17 | C24: 170.18
B25: 14.42 | C25: 165.10
B26: 15.80 | C26: 162.16
B27: 14.72 | C27: 167.64
B28: 14.67 | C28: 167.65
B29: 14.25 | C29: 167.64
B30: 15.17 | C30: 162.56
B31: 15.55 | C31: 162.56
B32: 14.92 | C32: 190.50
B33: 15.08 | C33: 172.72
B34: 14.08 | C34: 182.88
B35: 15.50 | C35: 172.72
A36: average | B36: =AVERAGE(B2:B35) -> 15.228529411764709 | C36: =AVERAGE(C2:C35) -> 167.77794117647062

A1: Per 5 | B1: age (yr) | C1: height (cm)
B2: 15.33 | C2: 189.23
B3: 17.58 | C3: 160.02
B4: 17.40 | C4: =71*2.54 -> 180.34
B5: 14.16 | C5: =64*2.54 -> 162.56
B6: 15.50 | C6: 157.48
B7: 15.08 | C7: 170.18
B8: 16.50 | C8: 172.72
B9: 15.33 | C9: 170.18
B10: 16.75 | C10: 175.26
B11: 16.25 | C11: 162.56
B12: 14.16 | C12: 167.18
B13: 15.75 | C13: 167.64
B14: 15.14 | C14: =72*2.54 -> 182.88
B15: 14.33 | C15: 154.94
B16: 15.50 | C16: 182.88
B17: 16.20 | C17: 177.80
B18: 14.42 | C18: 170.18
B19: 15.25 | C19: 170.18
B20: 15.00 | C20: 170.18
B21: 14.50 | C21: 166.56
B22: 13.75 | C22: 162.56
B23: 14.67 | C23: 170.18
B24: 15.25 | C24: 180.34
B25: 14.84 | C25: 160.02
B26: 14.83 | C26: 167.52
B27: 15.75 | C27: 160.02
B28: 14.08 | C28: 152.40
B29: 15.25 | C29: 165.10
B30: 15.50 | C30: =60*2.54 -> 152.40
B31: 14.62 | C31: 167.64
B32: 14.20 | C32: 182.88
B33: 14.17 | C33: 165.10
B34: 14.92 | C34: 165.10
A35: average | B35: =AVERAGE(B2:B34) -> 15.210909090909091 | C35: =AVERAGE(C2:C34) -> 168.55181818181825