2: AP Biology | 2: Book (Campbell 7th Edition) | A2: Study Guide | B2: AP Test Prep | C2: Subtotal | D2: Tax (.0825) and S/H (~10%) | E2: Total
3: Option 1 | 3: 93.47 | C3: 93.47 | D3: 17.03 | E3: =E3+F3+G3 -> 102.23599999999999
4: Option 2 | 4: 93.47 | A4: 18.97 | C4: 112.44 | D4: 20.56 | E4: =E4+F4+G4 -> 130.583
5: Option 3 | 5: 93.47 | A5: 18.97 | B5: 14.97 | C5: 122.44 | D5: 22.56 | E5: =E5+F5+G5 -> $145.00
6: Option 4 | 6: 103.47 Including Test prep book | B6: included | C6: 103.47 | D6: 19.03 | E6: =E6+F6+G6 -> 114.077
7: Option 5 | A7: 18.97 | C7: 18.97 | D7: 3.53 | E7: =E6+F6+G6 -> 114.077
8: Option 6 | B8: 14.97 | C8: 14.97 | D8: 2.73 | E8: =E6+F6+G6 -> 114.077

A1: Assignment | B1: Format
A2: Chapters 50-55 (Campbell, Biology 7th Edition) | B2: See the Homework Calendar for details
A3: Book Review (extra credit) | B3: Pick either a fiction or non-fiction book from the list, instructions are listed later in the letter for the typed assignment, due end of September.

A1: Assignments | B1: Topics | C1: Date Due
A2: Book Review #1 | B2: Your Choice/ Extra Credit | C2: September 29, 2006
A3: Article Review #2 | B3: Photosynthesis | C3: October 27, 2006
A4: Article Review #3 | B4: Cell Reproduction (Extra Credit) | C4: December 1, 2006
A5: Article Review #4 | B5: Genes | C5: January 12, 2007
A6: Article Review #5 | B6: Prokaryotes (Extra Credit) | C6: February 23, 2007
A7: Article Review #6 | B7: Evolution: Mechanisms | C7: March 30, 2007
A8: Article Review #7** | B8: Bioethics (Extra Credit**) | C8: May 7, 2007
A9: **(Note: students taking the AP Exam are exempt from #7 Article Review, if you do not take the AP Exam you must complete Article Review #7).