A1: Time (min) | B1: # of Sowbugs Wet | C1: # of Sowbugs Dry
A2: 0 | B2: 5 | C2: 5
A3: 1 | B3: 4 | C3: 6
A4: 2 | B4: 5 | C4: 5
A5: 3 | B5: 5 | C5: 5
A6: 4 | B6: 6 | C6: 4
A7: 5 | B7: 5 | C7: 5
A8: 6 | B8: 4 | C8: 6
A9: 7 | B9: 7 | C9: 3
A10: 8 | B10: 5 | C10: 5
A11: 9 | B11: 8 | C11: 2
A12: 10 | B12: 9 | C12: 1
A13: Mean | B13: 5.7 | C13: 4.3

A1: Substance | B1: Benedict’s Solution | C1: IKI Solution | D1: Sudan’s IV Solution | E1: Biuret’s Solution
A2: Honey | B2: + (yellow) | C2: - | D2: - | E2: -
A3: Oil | B3: - | C3: - | D3: + (floating red droplets) | E3: -
A4: Egg White | B4: - | C4: - | D4: - | E4: + (violet)

A1: Time(min) | B1: Light (# of sowbugs) | C1: Dark (# of sowbugs)
A2: 1.0 | B2: 4 | C2: =10-B2 -> 6
A3: 2.0 | B3: 4 | C3: =10-B3 -> 6
A4: 3.0 | B4: 2 | C4: =10-B4 -> 8
A5: 4.0 | B5: 2 | C5: =10-B5 -> 8
A6: 5.0 | B6: 3 | C6: =10-B6 -> 7
A7: 6.0 | B7: 1 | C7: =10-B7 -> 9
A8: 7.0 | B8: 2 | C8: =10-B8 -> 8
A9: 8.0 | B9: 2 | C9: =10-B9 -> 8
A10: 9.0 | B10: 5 | C10: =10-B10 -> 5
A11: 10.0 | B11: 5 | C11: =10-B11 -> 5
A12: Average | B12: =AVERAGE(B2:B11) -> 3.0 | C12: =AVERAGE(C2:C11) -> 7.0