B1: # of leaf disks floating
A2: Time(min) | B2: Table 1 | C2: Table 2 | D2: Table 3 | E2: Table 4 | F2: Table 5 | G2: Table 6 | H2: Table 7 | I2: Table 8
A3: 0 | B3: 0 | C3: 0 | D3: 0 | E3: 0 | F3: 0 | G3: 0 | H3: 0 | I3: 0
A4: 1 | B4: 1 | C4: 2 | D4: 0 | E4: 0 | F4: 0 | G4: 0 | H4: 0 | I4: 0
A5: 2 | B5: 3 | C5: 3 | D5: 2 | E5: 1 | F5: 1 | G5: 0 | H5: 1 | I5: 0
A6: 3 | B6: 5 | C6: 4 | D6: 3 | E6: 2 | F6: 1 | G6: 1 | H6: 1 | I6: 2
A7: 4 | B7: 7 | C7: 6 | D7: 5 | E7: 5 | F7: 2 | G7: 3 | H7: 2 | I7: 4
A8: 5 | B8: 8 | C8: 7 | D8: 6 | E8: 7 | F8: 2 | G8: 4 | H8: 3 | I8: 5
A9: 6 | B9: 9 | C9: 8 | D9: 7 | E9: 8 | F9: 4 | G9: 6 | H9: 4 | I9: 5
A10: 7 | B10: 10 | C10: 9 | D10: 8 | E10: 9 | F10: 5 | G10: 7 | H10: 5 | I10: 5
A11: 8 | B11: 10 | C11: 10 | D11: 9 | E11: 10 | F11: 6 | G11: 7 | H11: 6 | I11: 6
A12: 9 | D12: 10 | F12: 7 | G12: 8 | H12: 7 | I12: 7
A13: 10 | F13: 8 | G13: 9 | H13: 8 | I13: 9
A14: 11 | F14: 10 | G14: 10 | H14: 9 | I14: 10
A15: 12 | H15: 10

A1: Time(min) | B1: Table 1 | C1: Table 2 | D1: Mean
A2: 0 | B2: 0 | C2: 0 | D2: =AVERAGE(B2:C2) -> 0
A3: 1 | B3: 1 | C3: 2 | D3: =AVERAGE(B3:C3) -> 1.5
A4: 2 | B4: 3 | C4: 3 | D4: =AVERAGE(B4:C4) -> 3
A5: 3 | B5: 5 | C5: 4 | D5: =AVERAGE(B5:C5) -> 4.5
A6: 4 | B6: 7 | C6: 6 | D6: =AVERAGE(B6:C6) -> 6.5
A7: 5 | B7: 8 | C7: 7 | D7: =AVERAGE(B7:C7) -> 7.5
A8: 6 | B8: 9 | C8: 8 | D8: =AVERAGE(B8:C8) -> 8.5
A9: 7 | B9: 10 | C9: 9 | D9: =AVERAGE(B9:C9) -> 9.5
A10: 8 | B10: 10 | C10: 10 | D10: =AVERAGE(B10:C10) -> 10
A11: 9
A12: 10
A13: 11
A14: 12

B1: Means
A2: Time(min) | B2: Table 1/2 | C2: Table 3/ 4 | D2: Table 5/ 6 | E2: Table 7/8
A3: 0 | B3: 0 | C3: 0 | D3: 0 | E3: 0
A4: 1 | B4: 1 | C4: 0 | D4: 0 | E4: 0
A5: 2 | B5: 3 | C5: 1 | D5: 0 | E5: 0
A6: 3 | B6: 5 | C6: 2 | D6: 1 | E6: 2
A7: 4 | B7: 7 | C7: 5 | D7: 3 | E7: 4
A8: 5 | B8: 8 | C8: 7 | D8: 4 | E8: 5
A9: 6 | B9: 9 | C9: 8 | D9: 6 | E9: 5
A10: 7 | B10: 10 | C10: 9 | D10: 7 | E10: 5
A11: 8 | B11: 10 | C11: 10 | D11: 7 | E11: 6
A12: 9 | D12: 8 | E12: 7
A13: 10 | D13: 9 | E13: 9
A14: 11 | D14: 10 | E14: 10
A15: 12