A1: Sowbug Lab Period 5
A2: Table 1 | B2: Side 1 | C2: Side 2 | E2: Table 2 | F2: Side 1 | G2: Side 2 | I2: Table 3 | J2: Side 1 | K2: Side 2 | M2: Table 4 | N2: Side 1 | O2: Side 2
A3: Time (min) | B3: Wet | C3: Dry | E3: Time (min) | F3: Light | G3: Dark | I3: Time (min) | J3: dirt | K3: plastic | M3: Time (min) | N3: Dark | O3: Light
A4: 0 | B4: 5 | C4: =10-B4 -> 5 | E4: 0 | F4: 5 | G4: =10-F4 -> 5 | I4: 0 | J4: 5 | K4: =10-J4 -> 5 | M4: 0 | N4: 5 | O4: =10-N4 -> 5
A5: 1 | B5: 9 | C5: =10-B5 -> 1 | E5: 1 | F5: 6 | G5: =10-F5 -> 4 | I5: 1 | J5: 8 | K5: =10-J5 -> 2 | M5: 1 | N5: 6 | O5: =10-N5 -> 4
A6: 2 | B6: 5 | C6: =10-B6 -> 5 | E6: 2 | F6: 6 | G6: =10-F6 -> 4 | I6: 2 | J6: 10 | K6: =10-J6 -> 0 | M6: 2 | N6: 5 | O6: =10-N6 -> 5
A7: 3 | B7: 4 | C7: =10-B7 -> 6 | E7: 3 | F7: 3 | G7: =10-F7 -> 7 | I7: 3 | J7: 9 | K7: =10-J7 -> 1 | M7: 3 | N7: 5 | O7: =10-N7 -> 5
A8: 4 | B8: 4 | C8: =10-B8 -> 6 | E8: 4 | F8: 4 | G8: =10-F8 -> 6 | I8: 4 | J8: 10 | K8: =10-J8 -> 0 | M8: 4 | N8: 6 | O8: =10-N8 -> 4
A9: 5 | B9: 6 | C9: =10-B9 -> 4 | E9: 5 | F9: 1 | G9: =10-F9 -> 9 | I9: 5 | J9: 9 | K9: =10-J9 -> 1 | M9: 5 | N9: 7 | O9: =10-N9 -> 3
A10: 6 | B10: 6 | C10: =10-B10 -> 4 | E10: 6 | F10: 4 | G10: =10-F10 -> 6 | I10: 6 | J10: 9 | K10: =10-J10 -> 1 | M10: 6 | N10: 9 | O10: =10-N10 -> 1
A11: 7 | B11: 8 | C11: =10-B11 -> 2 | E11: 7 | F11: 2 | G11: =10-F11 -> 8 | I11: 7 | J11: 9 | K11: =10-J11 -> 1 | M11: 7 | N11: 6 | O11: =10-N11 -> 4
A12: 8 | B12: 7 | C12: =10-B12 -> 3 | E12: 8 | F12: 1 | G12: =10-F12 -> 9 | I12: 8 | J12: 9 | K12: =10-J12 -> 1 | M12: 8 | N12: 4 | O12: =10-N12 -> 6
A13: 9 | B13: 6 | C13: =10-B13 -> 4 | E13: 9 | F13: 0 | G13: =10-F13 -> 10 | I13: 9 | J13: 9 | K13: =10-J13 -> 1 | M13: 9 | N13: 8 | O13: =10-N13 -> 2
A14: 10 | B14: 7 | C14: =10-B14 -> 3 | E14: 10 | F14: 1 | G14: =10-F14 -> 9 | I14: 10 | J14: 7 | K14: =10-J14 -> 3 | M14: 10 | N14: 8 | O14: =10-N14 -> 2
A16: Mean | B16: =AVERAGE(B4:B15) -> 6.0909090909090908 | C16: =AVERAGE(C4:C15) -> 3.9090909090909092 | F16: =AVERAGE(F4:F15) -> 3.0 | G16: =AVERAGE(G4:G15) -> 7.0 | J16: =AVERAGE(J4:J15) -> 8.545454545454545 | K16: =AVERAGE(K4:K15) -> 1.4545454545454546 | N16: =AVERAGE(N4:N15) -> 6.2727272727272725 | O16: =AVERAGE(O4:O15) -> 3.7272727272727271
A19: Table 5 | B19: Side 1 | C19: Side 2 | E19: Table 6 | F19: Side 1 | G19: Side 2 | I19: Table 7 | J19: Side 1 | K19: Side 2 | M19: Table 8 | N19: Side 1 | O19: Side 2
A20: Time (min) | B20: Dark | C20: Light | E20: Time (min) | F20: Dark | G20: Light | I20: Time (min) | J20: Dark | K20: Light | M20: Time (min) | N20: Wet | O20: Dry
A21: 0 | B21: 5 | C21: =10-B21 -> 5 | E21: 0 | F21: 5 | G21: =10-F21 -> 5 | I21: 0 | J21: 5 | K21: =10-J21 -> 5 | M21: 0 | N21: 5 | O21: =10-N21 -> 5
A22: 1 | B22: 3 | C22: =10-B22 -> 7 | E22: 1 | F22: 6 | G22: =10-F22 -> 4 | I22: 1 | J22: 6 | K22: =10-J22 -> 4 | M22: 1 | N22: 4 | O22: =10-N22 -> 6
A23: 2 | B23: 4 | C23: =10-B23 -> 6 | E23: 2 | F23: 6 | G23: =10-F23 -> 4 | I23: 2 | J23: 5 | K23: =10-J23 -> 5 | M23: 2 | N23: 6 | O23: =10-N23 -> 4
A24: 3 | B24: 5 | C24: =10-B24 -> 5 | E24: 3 | F24: 5 | G24: =10-F24 -> 5 | I24: 3 | J24: 6 | K24: =10-J24 -> 4 | M24: 3 | N24: 6 | O24: =10-N24 -> 4
A25: 4 | B25: 3 | C25: =10-B25 -> 7 | E25: 4 | F25: 7 | G25: =10-F25 -> 3 | I25: 4 | J25: 5 | K25: =10-J25 -> 5 | M25: 4 | N25: 5 | O25: =10-N25 -> 5
A26: 5 | B26: 4 | C26: =10-B26 -> 6 | E26: 5 | F26: 5 | G26: =10-F26 -> 5 | I26: 5 | J26: 2 | K26: =10-J26 -> 8 | M26: 5 | N26: 4 | O26: =10-N26 -> 6
A27: 6 | B27: 1 | C27: =10-B27 -> 9 | E27: 6 | F27: 4 | G27: =10-F27 -> 6 | I27: 6 | J27: 5 | K27: =10-J27 -> 5 | M27: 6 | N27: 2 | O27: =10-N27 -> 8
A28: 7 | B28: 3 | C28: =10-B28 -> 7 | E28: 7 | F28: 5 | G28: =10-F28 -> 5 | I28: 7 | J28: 5 | K28: =10-J28 -> 5 | M28: 7 | N28: 2 | O28: =10-N28 -> 8
A29: 8 | B29: 4 | C29: =10-B29 -> 6 | E29: 8 | F29: 5 | G29: =10-F29 -> 5 | I29: 8 | J29: 4 | K29: =10-J29 -> 6 | M29: 8 | N29: 2 | O29: =10-N29 -> 8
A30: 9 | B30: 5 | C30: =10-B30 -> 5 | E30: 9 | F30: 6 | G30: =10-F30 -> 4 | I30: 9 | J30: 6 | K30: =10-J30 -> 4 | M30: 9 | N30: 3 | O30: =10-N30 -> 7
A31: 10 | B31: 5 | C31: =10-B31 -> 5 | E31: 10 | F31: 7 | G31: =10-F31 -> 3 | I31: 10 | J31: 3 | K31: =10-J31 -> 7 | M31: 10 | N31: 3 | O31: =10-N31 -> 7
B32: =AVERAGE(B21:B31) -> 3.8181818181818183 | C32: =AVERAGE(C21:C31) -> 6.1818181818181817 | F32: =AVERAGE(F21:F31) -> 5.5454545454545459 | G32: =AVERAGE(G21:G31) -> 4.4545454545454541 | J32: =AVERAGE(J21:J31) -> 4.7272727272727275 | K32: =AVERAGE(K21:K31) -> 5.2727272727272725 | N32: =AVERAGE(N21:N31) -> 3.8181818181818183 | O32: =AVERAGE(O21:O31) -> 6.1818181818181817