B1: Table 1&2 | C1: Table 3&4 | D1: Table5&6 | E1: Table7&8
A2: % Sucrose | F2: mean | G2: % Sucrose | H2: mean
A3: 0 | B3: 1..30 | C3: 1.10 | D3: 1.90 | E3: 5.61 | F3: =AVERAGE(B3:E3) -> -0.87 | G3: 0 | H3: =AVERAGE(B3:E3) -> -0.87
A4: 7 | B4: 3.35 | C4: =((1.83-1.71)/1.71)*100 -> 7.0175438596491295 | D4: 10.00 | E4: =((1.91-1.8)/1.8)*100 -> 6.1111111111111036 | F4: =AVERAGE(B4:E4) -> 6.6196637426900589 | G4: 7 | H4: =AVERAGE(B4:E4) -> 6.6196637426900589
A5: 14 | B5: -1.24 | C5: -3.80 | D5: -6.84 | E5: -14.52 | F5: =AVERAGE(B5:E5) -> -6.60 | G5: 14 | H5: =AVERAGE(B5:E5) -> -6.60
A6: 21 | B6: -5.32 | C6: -6.00 | D6: -14.74 | E6: -20.00 | F6: =AVERAGE(B6:E6) -> -11.515000000000001 | G6: 21 | H6: =AVERAGE(B6:E6) -> -11.515000000000001
A7: 28 | B7: -8.90 | C7: -16.60 | D7: -13.43 | E7: -3.82 | F7: =AVERAGE(B7:E7) -> -10.6875 | G7: 28 | H7: =AVERAGE(B7:E7) -> -10.6875
A8: 35 | B8: -9.73 | C8: -10.00 | D8: -15.84 | E8: -19.23 | F8: =AVERAGE(B8:E8) -> -13.70 | G8: 35 | H8: =AVERAGE(B8:E8) -> -13.70

B1: Table 1&2 | C1: Table 3&4 | D1: Table5&6 | E1: Table7&8
A2: % Sucrose | F2: mean | G2: % Sucrose | H2: mean
A3: 0 | B3: 2.91 | C3: =((2.81-1.61)/1.61)*100 -> 74.534161490683232 | D3: -6.12 | E3: =((2-2.5)/2.5)*100 -> -20.00 | F3: =AVERAGE(B3:E3) -> 12.831040372670806 | G3: 0 | H3: =AVERAGE(B3:E3) -> 12.831040372670806
A4: 7 | B4: 0.00 | C4: -9.42 | D4: -0.93 | E4: -1.30 | F4: =AVERAGE(B4:E4) -> -2.9125000000000001 | G4: 7 | H4: =AVERAGE(B4:E4) -> -2.9125000000000001
A5: 14 | B5: -5.79 | C5: -43.48 | D5: -5.35 | E5: -23.30 | F5: =AVERAGE(B5:E5) -> -19.48 | G5: 14 | H5: =AVERAGE(B5:E5) -> -19.48
A6: 21 | B6: -14.85 | C6: -4.40 | D6: -17.92 | E6: -20.00 | F6: =AVERAGE(B6:E6) -> -14.2925 | G6: 21 | H6: =AVERAGE(B6:E6) -> -14.2925
A7: 28 | B7: -14.80 | C7: -13.24 | D7: -0.18 | E7: -37.50 | F7: =AVERAGE(B7:E7) -> -16.43 | G7: 28 | H7: =AVERAGE(B7:E7) -> -16.43
A8: 35 | B8: -13.99 | C8: -27.00 | D8: -18.72 | E8: -22.76 | F8: =AVERAGE(B8:E8) -> -20.6175 | G8: 35 | H8: =AVERAGE(B8:E8) -> -20.6175

A1: % Sucrose | F1: mean | G1: % Sucrose | H1: mean
A2: 0 | B2: 2.67 | C2: 4.00 | D2: 45.30 | E2: -5.65 | F2: =AVERAGE(B2:E2) -> 11.58 | G2: 0 | H2: =AVERAGE(B2:E2) -> 11.58
A3: 7 | B3: -33.72 | C3: -3.00 | D3: 11.84 | E3: 140.95 | F3: =AVERAGE(B3:E3) -> 29.017499999999998 | G3: 7 | H3: =AVERAGE(B3:E3) -> 29.017499999999998
A4: 14 | B4: -2.26 | C4: -5.00 | D4: 61.07 | E4: -15.11 | F4: =AVERAGE(B4:E4) -> 9.6750000000000007 | G4: 14 | H4: =AVERAGE(B4:E4) -> 9.6750000000000007
A5: 21 | B5: -42.06 | C5: -18.00 | D5: -5.10 | E5: -71.09 | F5: =AVERAGE(B5:E5) -> -34.0625 | G5: 21 | H5: =AVERAGE(B5:E5) -> -34.0625
A6: 28 | B6: -12.40 | C6: -17.00 | D6: 5.42 | E6: -20.86 | F6: =AVERAGE(B6:E6) -> -11.21 | G6: 28 | H6: =AVERAGE(B6:E6) -> -11.21
A7: 35 | B7: -39.84 | C7: -9.00 | D7: -6.60 | E7: -12.45 | F7: =AVERAGE(B7:E7) -> -16.9725 | G7: 35 | H7: =AVERAGE(B7:E7) -> -16.9725